{
  "$schema": "../../schemas/pattern-backlog.schema.json",
  "backlogVersion": "1.0",
  "generatedBy": "manual research（spec Post-Stability Phase G，2026-09-24）",
  "note": "格局待辦清單。原則：**只登錄有古典原文可引者，不追數量**；每條須標明是否已實作（implemented）、與既有格局等價（equivalent）、待研究（research）或不予採用（rejected）。未經 Owner 批准不得將 research 格局實作為 canonical；實作前一律先進 Research Queue。",
  "entries": [
    {
      "patternKey": "PAT.DUIMIAN_CHAODOU",
      "name": {
        "zh-TW": "對面朝斗格",
        "zh-CN": "对面朝斗格"
      },
      "status": "implemented",
      "quote": "论对面朝斗格 子午宫逢禄存是也　诗曰 禄有对面在迁移，子午逢之利禄宜，德合吉壤人敬重，双全富贵福稀奇。",
      "sourceId": "SRC.QUANSHU.WIKISOURCE",
      "locator": {
        "volume": "卷一",
        "chapter": "論格局",
        "section": "論對面朝斗格",
        "anchor": "女命骨髓赋",
        "archiveUrl": "https://zh.wikisource.org/wiki/紫微斗數全書/卷一"
      },
      "relatedRuleId": "ZW.PAT.DUIMIAN_CHAODOU.001",
      "researchId": null,
      "gap": null,
      "note": "原文有明確定義與詩曰，來源清楚。（2026-09-24 校正：原文位於《全書》卷一（女命骨髓賦之後的論格局段），非卷三；已逐字核對維基文庫卷一電子文本。）（2026-09-24 Owner 批准實作 → canonical ZW.PAT.DUIMIAN_CHAODOU.001。）"
    },
    {
      "patternKey": "PAT.KEQUANLU_ZHU",
      "name": {
        "zh-TW": "科權祿主格",
        "zh-CN": "科权禄主格"
      },
      "status": "research",
      "quote": "论科权禄主格 诗曰 禄权周勃命中逢，入相王朝赞圣功，迎合权星兼吉曜，巍巍富贵列三公。",
      "sourceId": "SRC.QUANSHU.WIKISOURCE",
      "locator": {
        "volume": "卷一",
        "chapter": "論格局",
        "section": "論科權祿主格",
        "anchor": "女命骨髓赋",
        "archiveUrl": "https://zh.wikisource.org/wiki/紫微斗數全書/卷一"
      },
      "relatedRuleId": null,
      "researchId": "RSH.PATTERN.BACKLOG",
      "gap": "原文只有詩曰、無一句式定義；三化齊會之宮位條件（命宮或三方）需先確定，避免與既有四化類格局重疊。",
      "note": "定義不足，暫不實作。（2026-09-24 校正：原文位於《全書》卷一（女命骨髓賦之後的論格局段），非卷三；已逐字核對維基文庫卷一電子文本。）"
    },
    {
      "patternKey": "PAT.ZUOYOU_CHAOYUAN",
      "name": {
        "zh-TW": "左右朝垣格",
        "zh-CN": "左右朝垣格"
      },
      "status": "implemented",
      "quote": "论左右朝垣格 诗曰 天星左右最高明，若在三方禄位兴，武职高登应显佐，文人名誉列公卿。",
      "sourceId": "SRC.QUANSHU.WIKISOURCE",
      "locator": {
        "volume": "卷一",
        "chapter": "論格局",
        "section": "論左右朝垣格",
        "anchor": "女命骨髓赋",
        "archiveUrl": "https://zh.wikisource.org/wiki/紫微斗數全書/卷一"
      },
      "relatedRuleId": "ZW.PAT.ZUOYOU_CHAOYUAN.001",
      "researchId": null,
      "gap": null,
      "note": "與既有格局有明確區辨，適合優先研究。（2026-09-24 校正：原文位於《全書》卷一（女命骨髓賦之後的論格局段），非卷三；已逐字核對維基文庫卷一電子文本。）（2026-09-24 Owner 批准實作 → canonical ZW.PAT.ZUOYOU_CHAOYUAN.001。）"
    },
    {
      "patternKey": "PAT.JIANWENWU",
      "name": {
        "zh-TW": "兼文武格",
        "zh-CN": "兼文武格"
      },
      "status": "implemented",
      "quote": "论兼文武格 文曲武曲在身命是也　诗曰 格名文武少人知，遇此须教百事通，更值命宫无杀破，滔滔荣显是英雄。",
      "sourceId": "SRC.QUANSHU.WIKISOURCE",
      "locator": {
        "volume": "卷一",
        "chapter": "論格局",
        "section": "論兼文武格",
        "anchor": "女命骨髓赋",
        "archiveUrl": "https://zh.wikisource.org/wiki/紫微斗數全書/卷一"
      },
      "relatedRuleId": "ZW.PAT.JIANWENWU.001",
      "researchId": null,
      "gap": null,
      "note": "定義明確，可作為下一個實作候選。（2026-09-24 校正：原文位於《全書》卷一（女命骨髓賦之後的論格局段），非卷三；已逐字核對維基文庫卷一電子文本。）（2026-09-24 Owner 批准實作 → canonical ZW.PAT.JIANWENWU.001。）"
    },
    {
      "patternKey": "PAT.WENXING_CHAOMING",
      "name": {
        "zh-TW": "文星朝命格",
        "zh-CN": "文星朝命格"
      },
      "status": "research",
      "quote": "论文星朝命格 诗曰 文昌文曲最荣华，值此须生富贵家，更得三方祥曜拱，却如锦上又添花。",
      "sourceId": "SRC.QUANSHU.WIKISOURCE",
      "locator": {
        "volume": "卷一",
        "chapter": "論格局",
        "section": "論文星朝命格",
        "anchor": "女命骨髓赋",
        "archiveUrl": "https://zh.wikisource.org/wiki/紫微斗數全書/卷一"
      },
      "relatedRuleId": null,
      "researchId": "RSH.PATTERN.BACKLOG",
      "gap": "無一句式定義，僅詩曰（昌曲「值此」、「三方祥曜拱」）；需先確定昌曲所在宮位條件。",
      "note": "定義不足。（2026-09-24 校正：原文位於《全書》卷一（女命骨髓賦之後的論格局段），非卷三；已逐字核對維基文庫卷一電子文本。）"
    },
    {
      "patternKey": "PAT.SHIZHONG_YINYU",
      "name": {
        "zh-TW": "石中隱玉格",
        "zh-CN": "石中隐玉格"
      },
      "status": "implemented",
      "quote": "论石中隐玉格 命在子午逢巨门是也　诗曰 巨门子午二宫逢，身命逢之必贵荣，更得三方科禄照，石中隐玉是丰隆。",
      "sourceId": "SRC.QUANSHU.WIKISOURCE",
      "locator": {
        "volume": "卷一",
        "chapter": "論格局",
        "section": "論石中隱玉格",
        "anchor": "女命骨髓赋",
        "archiveUrl": "https://zh.wikisource.org/wiki/紫微斗數全書/卷一"
      },
      "relatedRuleId": "ZW.PAT.SHIZHONG_YINYU.001",
      "researchId": null,
      "gap": null,
      "note": "定義明確且兩處原文互證，優先研究候選。（2026-09-24 校正：原文位於《全書》卷一（女命骨髓賦之後的論格局段），非卷三；已逐字核對維基文庫卷一電子文本。）（2026-09-24 Owner 批准實作 → canonical ZW.PAT.SHIZHONG_YINYU.001。）"
    },
    {
      "patternKey": "PAT.HUOGUI",
      "name": {
        "zh-TW": "貪狼遇火名為火貴格（火貴格）",
        "zh-CN": "贪狼遇火名为火贵格"
      },
      "status": "equivalent",
      "quote": "论贪狼遇火名为火贵格 三合照身命是也　诗曰 火遇贪狼照命宫，封侯食禄是英雄，三方倘若无凶杀，到老应知福寿隆。",
      "sourceId": "SRC.QUANSHU.WIKISOURCE",
      "locator": {
        "volume": "卷一",
        "chapter": "論格局",
        "section": "論貪狼遇火名為火貴格",
        "anchor": "女命骨髓赋",
        "archiveUrl": "https://zh.wikisource.org/wiki/紫微斗數全書/卷一"
      },
      "relatedRuleId": "ZW.PAT.YINGHUO.001",
      "researchId": null,
      "gap": null,
      "note": "與既有 ZW.PAT.YINGHUO.001（火貪／鈴貪）為同一格局之古典名稱。已實作，故不重複建立；惟既有名稱「火貴格」可考慮加入該規則名稱之別名（待 Owner 決定）。（2026-09-24 校正：原文位於《全書》卷一（女命骨髓賦之後的論格局段），非卷三；已逐字核對維基文庫卷一電子文本。）"
    },
    {
      "patternKey": "PAT.MATOU_DAIJIAN",
      "name": {
        "zh-TW": "馬頭帶劍",
        "zh-CN": "马头带剑"
      },
      "status": "research",
      "quote": "马头带剑 谓马有刃是也不是居午格。",
      "sourceId": "SRC.QUANSHU.WIKISOURCE",
      "locator": {
        "volume": "卷一",
        "chapter": "定貴局",
        "section": "馬頭帶劍",
        "anchor": "定贵局",
        "archiveUrl": "https://zh.wikisource.org/wiki/紫微斗數全書/卷一"
      },
      "relatedRuleId": null,
      "researchId": "RSH.PATTERN.BACKLOG",
      "gap": "本句原文語意殘缺（「谓马有刃是也不是居午格」），成句疑有脫誤，需先校勘或取得第二來源，否則無法確定條件（常見說法為天馬與擎羊同宮於午）。",
      "note": "原文殘缺 → 不得依此實作；需校勘後再議。（2026-09-25 校正：原記卷三／格局，實位於《全書》卷一〈定貴局〉「某某 謂…是也」逐條段；已逐字核對維基文庫卷一電子文本。同書另有 3 處「馬頭帶劍」：卷一〈骨髓賦〉「馬頭帶劍，鎮衛邊疆」、卷一女命骨髓賦註「马头带剑非夭折则主刑伤」、卷三「擎羊子午卯酉非夭折而刑伤…马头带剑，吉多勿论」，四處吉凶語意不一，更增校勘之必要。）"
    },
    {
      "patternKey": "PAT.SHIDE_HEGE",
      "name": {
        "zh-TW": "十二宮諸星得地合格訣",
        "zh-CN": "十二宫诸星得地合格诀"
      },
      "status": "research",
      "quote": "子安命 子宫贪狼杀阴星，机梁相拱福兴隆，庚辛乙癸生人美，一生富贵足丰荣。",
      "sourceId": "SRC.QUANSHU.WIKISOURCE",
      "locator": {
        "volume": "卷一",
        "chapter": "十二宮諸星得地／失陷訣",
        "section": "十二宮諸星得地合格訣",
        "archiveUrl": "https://zh.wikisource.org/wiki/紫微斗數全書/卷一"
      },
      "relatedRuleId": null,
      "researchId": "RSH.PATTERN.BACKLOG",
      "gap": "為逐宮歌訣（如『酉宫最喜太阴逢，巨日又逢当面冲，辛乙生人为贵格…』），屬「宮位＋星曜＋生年干」組合之合／破格判斷，體系與現行 24 格局不同；需先決定是否納入 Pattern Engine（或以另類規則表達）。",
      "note": "體系性議題，需 Owner 決策是否納入。（2026-09-24 校正：原文位於《全書》卷一，非卷三；已逐字核對維基文庫卷一電子文本。2026-09-25 補正：本訣不在〈論格局〉段，而在卷一〈十二宮諸星得地／失陷訣〉，共 12 條（子→亥安命）；quote 由原 wikitext 標題佔位改為首條逐字。）"
    },
    {
      "patternKey": "PAT.SHIDE_POGE",
      "name": {
        "zh-TW": "十二宮諸星失陷破格訣",
        "zh-CN": "十二宫诸星失陷破格诀"
      },
      "status": "research",
      "quote": "子丑安命 子午天机丑巨铃，此星落陷果为真，纵然化吉更为美，任他富贵不清宁。",
      "sourceId": "SRC.QUANSHU.WIKISOURCE",
      "locator": {
        "volume": "卷一",
        "chapter": "十二宮諸星得地／失陷訣",
        "section": "十二宮諸星失陷破格訣",
        "archiveUrl": "https://zh.wikisource.org/wiki/紫微斗數全書/卷一"
      },
      "relatedRuleId": null,
      "researchId": "RSH.PATTERN.BACKLOG",
      "gap": "同上（破格訣）。與得地合格訣成對，宜一併決策。",
      "note": "體系性議題。（2026-09-24 校正：原文位於《全書》卷一，非卷三；已逐字核對維基文庫卷一電子文本。2026-09-25 補正：本訣不在〈論格局〉段，而在卷一〈十二宮諸星得地／失陷訣〉逐宮條列；quote 由原 wikitext 標題佔位改為首條逐字。）"
    },
    {
      "patternKey": "PAT.CAIGUAN_GE",
      "name": {
        "zh-TW": "財官格／貴格（依生年干逐宮條列）",
        "zh-CN": "财官格／贵格（依生年干逐宫条列）"
      },
      "status": "rejected",
      "quote": "子宫喜丁己庚生人贵格，壬癸生人不耐久。",
      "sourceId": "SRC.QUANSHU.WIKISOURCE",
      "locator": {
        "volume": "卷二",
        "chapter": "諸星",
        "section": "紫微／諸星各宮生年干組合",
        "archiveUrl": "https://zh.wikisource.org/wiki/紫微斗數全書/卷二"
      },
      "relatedRuleId": null,
      "researchId": null,
      "gap": null,
      "note": "不予採用為「格局」：卷二中此類「某某生人財官格／貴格」係逐宮逐干的星情斷語（數十條，格式固定），並非具名格局；如要納入，應屬 Interpretation 層之宮干組合條件，而非 Pattern Engine。此決議已記錄以免日後重複評估。"
    }
  ]
}
